CourseCode,CourseName,Origin,Question,OptionA,OptionB,OptionC,OptionD,OptionE,OptionF,Answer,RelatedTextbook,RelatedChapter
BSCN9200,Family Health,T,A pregnant person living in a remote northern community has been informed that once their pregnancy reaches 36 weeks they must relocate to a larger centre until birth. This is an example of:,Family-centered care,Health inequality,Technological advances in health care,Social determinants of health,,,B,Leifer's Introduction to Maternity & Pediatric Nursing,1 - Overview of Perinatal & Pediatric Nursing in Canada
BSCN9200,Family Health,T,A group of people are discussing childbirth experiences. Which statement would most likely indicate that a person gave birth in the 1950s?,My partner stayed with me throughout labour and birth,The unit allowed me to give birth and recover in the same room,I was discharged from the hospital 1 week following the birth,The birthing centre rooms were decorated in a homelike fashion,,,C,Leifer's Introduction to Maternity & Pediatric Nursing,1 - Overview of Perinatal & Pediatric Nursing in Canada
BSCN9200,Family Health,T,A nursing student asks how to provide culturally competent care for 2SLGBTQ1+ patients. The first step is to:,Research credible information,Interview a 2SLGBTQ1+ person,Reflect on one’s own beliefs and biases,Join a support group advocating for 2SLGBTQ1+ people,,,C,Leifer's Introduction to Maternity & Pediatric Nursing,1 - Overview of Perinatal & Pediatric Nursing in Canada
BSCN9200,Family Health,T,"A nurse sends a diabetic educator the patient’s admission details, history, and diagnosis before discharge teaching. This is an example of:",Coordination of care,Accountability in nursing care,Global health,Health promotion,,,A,Leifer's Introduction to Maternity & Pediatric Nursing,1 - Overview of Perinatal & Pediatric Nursing in Canada
BSCN9200,Family Health,T,Which diagnosis is the nurse legally responsible to report?,Bronchiolitis,Sexually transmitted infection,Acute otitis media,Strep throat,,,B,Leifer's Introduction to Maternity & Pediatric Nursing,1 - Overview of Perinatal & Pediatric Nursing in Canada
BSCN9200,Family Health,T,What is true of family‑centred care?,The nurse’s role is to enter into a partnership with the family,Health care professionals are the primary decision makers,Family involvement during pregnancy and birth is integral,Families contribute their ability to accept and maintain control over health care,When a child is sick this impacts the whole family,,A|C|D|E,Leifer's Introduction to Maternity & Pediatric Nursing,1 - Overview of Perinatal & Pediatric Nursing in Canada
BSCN9200,Family Health,T,The Baby‑Friendly Initiative’s (BFI) main goal is to ensure infants are breastfed for 12 months.,TRUE,FALSE,,,,,B,Leifer's Introduction to Maternity & Pediatric Nursing,1 - Overview of Perinatal & Pediatric Nursing in Canada
BSCN9200,Family Health,T,"According to the FCMNC National Guidelines, early parent–infant attachment is critical for newborn development and healthy families.",TRUE,FALSE,,,,,A,Leifer's Introduction to Maternity & Pediatric Nursing,1 - Overview of Perinatal & Pediatric Nursing in Canada
